{"schema":"example.manifest/v3","case_id":"FX01_fixture","title":{"en":"Fixture case","es":"Caso de prueba"},"category":{"en":"Fixtures","es":"Datos de prueba"},"real_or_synthetic":"synthetic","expected_band":{"en":"A provider case: seven days of an early outbreak, written by hand so the site and the API run before any bake.","es":"Un caso de proveedor: siete días de un brote temprano, escrito a mano para que el sitio y la API funcionen antes de cualquier generación."},"engine":{"package":"pipeline","version":"0.00.000","model":"fixture, written by hand"},"params":{"beta":0.5,"gamma":0.25,"N":1000.0,"I0":10.0,"days":6},"seed":0,"artifact":{"path":"FX01_fixture/trace.json","format":"json","trace_schema":"example.trace/v1","bytes":214},"lane":"live","gate":{"lane":"live","pure_python":true,"wheels":["numpy"],"trace_bytes":214,"run_ms_budget":1500.0,"trace_bytes_budget":262144,"reasons":[]},"flags":[],"metrics":{},"expect":{"attack_rate":[0.1,0.2]}}